{
	"$schema": "https://raw.githubusercontent.com/Mangod4435/project-dasher/main/PJDSScheme.json",
	"name": "placeholder",
	"music": "res://Music/BIG-SHOT-DELTARUNE.mp3",
	"tempo": 140.0,
	"delay": 1.83,
	"notes": [
		{
			"beat": 5,
			"end": 3,
			"y": 2,
			"species": "Norm"
		},
		{
			"beat": 6,
			"end": 3,
			"y": 1,
			"species": "Norm"
		}
	]
}